{
  "boundaries": {
    "launch_to_child_ready_ns": 71943707,
    "launch_to_window_map_ns": 52423153
  },
  "idle": {
    "context_switches": 2,
    "cpu_ticks": 0,
    "rss_bytes": 51650560,
    "sample_seconds": 2.0,
    "warmup_seconds": 1.0
  },
  "isolation": {
    "cleanup_verified": true,
    "monitor": "DP-2",
    "no_initial_focus": true,
    "workspace": 8
  },
  "launch_mode": "standalone_process_launch",
  "notes": [],
  "processes": {
    "child_included": true,
    "child_pid": 4028388,
    "count": 2,
    "root_pids": [
      4028383
    ]
  },
  "schema": "splinterm.benchmark.graphical-idle.v1",
  "terminal": "foot",
  "valid": true
}
