{
  "boundaries": {
    "launch_to_child_ready_ns": 75110040,
    "launch_to_window_map_ns": 115722893
  },
  "idle": {
    "context_switches": 2,
    "cpu_ticks": 1,
    "rss_bytes": 50954240,
    "sample_seconds": 2.0,
    "warmup_seconds": 1.0
  },
  "isolation": {
    "cleanup_verified": true,
    "monitor": "DP-2",
    "no_initial_focus": true,
    "workspace": 8
  },
  "launch_mode": "prestarted_daemon_client_launch",
  "notes": [],
  "processes": {
    "child_included": true,
    "child_pid": 688799,
    "count": 3,
    "root_pids": [
      688785,
      688794
    ]
  },
  "schema": "splinterm.benchmark.graphical-idle.v1",
  "terminal": "splinterm",
  "valid": true
}
